<?xml version="1.0" encoding="UTF-8"?>
<!DOCTYPE doc SYSTEM "documents/naehesprache.dtd">
<doc ID="T002">
	<pb n="38">
		<line n="1">
			<lb>
				<VOR>Im Jahr 1640 umb das Neue Jahr da</VOR>
				<praed>
					<V ID="Fin"><VV>kamen</VV></V>
				</praed> in das darmstÃ¤dische Land <subj>eine Armate schwedisch
			Volk.</subj></lb><!--hier line-->
		</line>
		<line n="2">
			<lb n="3000,2000">
				<VOR>Die</VOR>
				<praed>
					<V ID="Fin"><HV>hatte</HV></V>
				</praed>
				<praed>
					<V ID="PII"><VV>gefuhret</VV></V>
				</praed>
				<subj >ein Hertzog von Weinmar.</subj></lb>
		</line>
		

	</pb>

</doc>
